-- 'Caminadora integrity'       ,'wls cll179135'         ,                     ,'Mantenimiento'                                                     ,6/26/2019
INSERT INTO MANTENIMIENTO(MAQUINA, PROVEEDOR, FECHA, DESCRIPCION) VALUES (9, 1, '2019/6/26', 'Mantenimiento');

-- 'Cross trainer integrity'    ,'nls cxx143851'         ,                     ,'Mantenimiento'                                                     ,6/26/2019
INSERT INTO MANTENIMIENTO(MAQUINA, PROVEEDOR, FECHA, DESCRIPCION) VALUES (51, 1, '2019/6/26', 'Mantenimiento');

-- 'Cross trainer integrity'    ,'nls cxx143845'         ,                     ,'Mantenimiento'                                                     ,6/26/2019
INSERT INTO MANTENIMIENTO(MAQUINA, PROVEEDOR, FECHA, DESCRIPCION) VALUES (52, 1, '2019/6/26', 'Mantenimiento');

-- 'Leg press '                 ,'hsllp'                 ,'nshsllp0319b077'    ,'Cambio de empuñadura (por garantia)'                               ,7/24/2019
INSERT INTO MANTENIMIENTO(MAQUINA, PROVEEDOR, FECHA, DESCRIPCION, REFACCIONES, GARANTIA) VALUES (133, 1, '2019/7/24', 'Cambio de empuñadura', TRUE, TRUE);


-- 'Banco multiposiciones'      ,'hdt-mab'               ,'ns190315hdtmab005d' ,'Cambio de acojinamiento (por garantia)'                            ,7/24/2019
INSERT INTO MANTENIMIENTO(MAQUINA, PROVEEDOR, FECHA, DESCRIPCION, REFACCIONES, GARANTIA) VALUES (112, 1, '2019/7/24', 'Cambio de acojinamiento', TRUE, TRUE);

-- '30 plyos'                   ,                        ,                     ,'Cambio físico'                                                     ,7/30/2019
-- ! FIXME omitir hasta que se incluyan los datos del otro gimnasio

-- 'Stack de peso (cross over)' ,                        ,'bbeni13130092'      ,'Pintura'                                                           ,7/31/2019
INSERT INTO MANTENIMIENTO(MAQUINA, PROVEEDOR, FECHA, DESCRIPCION) VALUES (127, 1, '2019/7/31', 'Pintura');

-- 'Stack de peso (cross over)' ,                        ,'bbeni13130034'      ,'Pintura'                                                           ,7/31/2019
INSERT INTO MANTENIMIENTO(MAQUINA, PROVEEDOR, FECHA, DESCRIPCION) VALUES (126, 1, '2019/7/31', 'Pintura');

-- 'Stack de peso (cross over)' ,                        ,                     ,'Pintura'                                                           ,7/31/2019
INSERT INTO MANTENIMIENTO(MAQUINA, PROVEEDOR, FECHA, DESCRIPCION) VALUES (128, 1, '2019/7/31', 'Pintura');

-- '4 plataformas power racks'  ,                        ,                     ,'Pintura'                                                           ,7/31/2019
INSERT INTO MANTENIMIENTO(MAQUINA, PROVEEDOR, FECHA, DESCRIPCION) VALUES (118, 1, '2019/7/31', 'Pintura');
INSERT INTO MANTENIMIENTO(MAQUINA, PROVEEDOR, FECHA, DESCRIPCION) VALUES (119, 1, '2019/7/31', 'Pintura');
INSERT INTO MANTENIMIENTO(MAQUINA, PROVEEDOR, FECHA, DESCRIPCION) VALUES (120, 1, '2019/7/31', 'Pintura');
INSERT INTO MANTENIMIENTO(MAQUINA, PROVEEDOR, FECHA, DESCRIPCION) VALUES (121, 1, '2019/7/31', 'Pintura');


-- 'HS-PEC'                     ,                        ,                     ,'Ajuste de selector'                                                ,8/6/2019
INSERT INTO MANTENIMIENTO(MAQUINA, PROVEEDOR, FECHA, DESCRIPCION) VALUES (88, 1, '2019/8/6', 'Pintura');


-- 'Banco olimpico'             ,                        ,                     ,'Ajuste de selector'                                                ,8/6/2019
-- ! FIXME No se puede identificar este registro - Esperamos revisión

-- 'C.T HXX110595'              ,                        ,                     ,'Ajuste de tapa'                                                    ,8/6/2019
INSERT INTO MANTENIMIENTO(MAQUINA, PROVEEDOR, FECHA, DESCRIPCION) VALUES (42, 1, '2019/8/6', 'Ajuste de tapa');

-- 'Smit machine'               ,                        ,                     ,'Lubricación '                                                      ,8/6/2019
INSERT INTO MANTENIMIENTO(MAQUINA, PROVEEDOR, FECHA, DESCRIPCION) VALUES (131, 1, '2019/8/6', 'Lubricación');

-- 'Plataforma power rack'      ,                        ,                     ,'Cambio físico'                                                     ,8/12/2019
INSERT INTO MANTENIMIENTO(MAQUINA, PROVEEDOR, FECHA, DESCRIPCION) VALUES (118, 1, '2019/8/12', 'Cambio físico');
INSERT INTO MANTENIMIENTO(MAQUINA, PROVEEDOR, FECHA, DESCRIPCION) VALUES (119, 1, '2019/8/12', 'Cambio físico');
INSERT INTO MANTENIMIENTO(MAQUINA, PROVEEDOR, FECHA, DESCRIPCION) VALUES (120, 1, '2019/8/12', 'Cambio físico');
INSERT INTO MANTENIMIENTO(MAQUINA, PROVEEDOR, FECHA, DESCRIPCION) VALUES (121, 1, '2019/8/12', 'Cambio físico');


-- 'Acrilicos precor'           ,                        ,                     ,'Cambio físico'                                                       ,8/12/2019
INSERT INTO MANTENIMIENTO(MAQUINA, PROVEEDOR, FECHA, DESCRIPCION) VALUES (126, 1, '2019/8/12', 'Cambio físico');
INSERT INTO MANTENIMIENTO(MAQUINA, PROVEEDOR, FECHA, DESCRIPCION) VALUES (127, 1, '2019/8/12', 'Cambio físico');
INSERT INTO MANTENIMIENTO(MAQUINA, PROVEEDOR, FECHA, DESCRIPCION) VALUES (128, 1, '2019/8/12', 'Cambio físico');

-- '30 pzas plyos'              ,                        ,                     ,'cambio físico'                                                     ,8/12/2019
-- ! FIXME ESPERAR A LOS OTROS DEL GIMNASIO

-- 'Abdominal cruch'            ,                        ,                     ,'Revisión; ajuste de tornilleria'                                   ,8/12/2019
INSERT INTO MANTENIMIENTO(MAQUINA, PROVEEDOR, FECHA, DESCRIPCION) VALUES (85, 1, '2019/8/12', 'Revisión; ajuste de tornillería');

-- '2 power mill'               ,                        ,                     ,'Revisión por fallaen carga electrica'                              ,8/14/2019
INSERT INTO MANTENIMIENTO(MAQUINA, PROVEEDOR, FECHA, DESCRIPCION) VALUES (68, 1, '2019/8/14', 'Revisión por falla en carga electrica');
INSERT INTO MANTENIMIENTO(MAQUINA, PROVEEDOR, FECHA, DESCRIPCION) VALUES (69, 1, '2019/8/14', 'Revisión por falla en carga electrica');

-- 'Hip & glute'                ,                        ,                     ,'Ajuste por ruido'                                                  ,8/14/2019
INSERT INTO MANTENIMIENTO(MAQUINA, PROVEEDOR, FECHA, DESCRIPCION) VALUES (84, 1, '2019/8/14', 'Ajuste por ruido');

-- 'Dip/chin asist'             ,'ncsss-adc031913026'    ,                     ,'Revisión por cable dañado'                                         ,8/14/2019
INSERT INTO MANTENIMIENTO(MAQUINA, PROVEEDOR, FECHA, DESCRIPCION) VALUES (84, 1, '2019/8/14', 'Revisión por cable dañado');

-- 'Caminadora integrity'       ,'nlshht121897'          ,'hct110152'          ,'Revisión por pantalla dañada'                                      ,8/14/2019
INSERT INTO MANTENIMIENTO(MAQUINA, PROVEEDOR, FECHA, DESCRIPCION) VALUES (12, 1, '2019/8/14', 'Revisión por pantalla dañada');

-- '3 Precor (doble polea)'     ,                        ,                     ,'Instalación de tornillos y calcomanias'                            ,8/14/2019
INSERT INTO MANTENIMIENTO(MAQUINA, PROVEEDOR, FECHA, DESCRIPCION) VALUES (126, 1, '2019/8/14', 'Instalación de tornillos y calcomanias');
INSERT INTO MANTENIMIENTO(MAQUINA, PROVEEDOR, FECHA, DESCRIPCION) VALUES (127, 1, '2019/8/14', 'Instalación de tornillos y calcomanias');
INSERT INTO MANTENIMIENTO(MAQUINA, PROVEEDOR, FECHA, DESCRIPCION) VALUES (128, 1, '2019/8/14', 'Instalación de tornillos y calcomanias');

-- 'Bicicleta spinning'         ,                        ,                     ,'Instalacion de tablero'                                            ,8/16/2019
-- TODO nserie IC-LFIC5B2-01

-- 'Precor'                     ,                        ,                     ,'Cambio de acrilico'                                                ,8/16/2019
INSERT INTO MANTENIMIENTO(MAQUINA, PROVEEDOR, FECHA, DESCRIPCION) VALUES (126, 1, '2019/8/16', 'Cambio de acrílico');
INSERT INTO MANTENIMIENTO(MAQUINA, PROVEEDOR, FECHA, DESCRIPCION) VALUES (127, 1, '2019/8/16', 'Cambio de acrílico');
INSERT INTO MANTENIMIENTO(MAQUINA, PROVEEDOR, FECHA, DESCRIPCION) VALUES (128, 1, '2019/8/16', 'Cambio de acrílico');


-- 'Power rack (GB)'            ,                        ,                     ,'Cambio de tabla'                                                   ,8/16/2019
-- ! FIXME Hay 4 Power Rack, se necesita más información - esperamos el otro gimnasio

-- 'Equipos de peso integrado'  ,                        ,                     ,'Ajuste'                                                            ,8/22/2019
INSERT INTO MANTENIMIENTO(MAQUINA, PROVEEDOR, FECHA, DESCRIPCION) VALUES (77, 1, '2019/8/22', 'Ajuste');
INSERT INTO MANTENIMIENTO(MAQUINA, PROVEEDOR, FECHA, DESCRIPCION) VALUES (78, 1, '2019/8/22', 'Ajuste');
INSERT INTO MANTENIMIENTO(MAQUINA, PROVEEDOR, FECHA, DESCRIPCION) VALUES (79, 1, '2019/8/22', 'Ajuste');
INSERT INTO MANTENIMIENTO(MAQUINA, PROVEEDOR, FECHA, DESCRIPCION) VALUES (80, 1, '2019/8/22', 'Ajuste');
INSERT INTO MANTENIMIENTO(MAQUINA, PROVEEDOR, FECHA, DESCRIPCION) VALUES (81, 1, '2019/8/22', 'Ajuste');
INSERT INTO MANTENIMIENTO(MAQUINA, PROVEEDOR, FECHA, DESCRIPCION) VALUES (82, 1, '2019/8/22', 'Ajuste');
INSERT INTO MANTENIMIENTO(MAQUINA, PROVEEDOR, FECHA, DESCRIPCION) VALUES (83, 1, '2019/8/22', 'Ajuste');
INSERT INTO MANTENIMIENTO(MAQUINA, PROVEEDOR, FECHA, DESCRIPCION) VALUES (84, 1, '2019/8/22', 'Ajuste');
INSERT INTO MANTENIMIENTO(MAQUINA, PROVEEDOR, FECHA, DESCRIPCION) VALUES (85, 1, '2019/8/22', 'Ajuste');
INSERT INTO MANTENIMIENTO(MAQUINA, PROVEEDOR, FECHA, DESCRIPCION) VALUES (86, 1, '2019/8/22', 'Ajuste');
INSERT INTO MANTENIMIENTO(MAQUINA, PROVEEDOR, FECHA, DESCRIPCION) VALUES (87, 1, '2019/8/22', 'Ajuste');
INSERT INTO MANTENIMIENTO(MAQUINA, PROVEEDOR, FECHA, DESCRIPCION) VALUES (88, 1, '2019/8/22', 'Ajuste');
INSERT INTO MANTENIMIENTO(MAQUINA, PROVEEDOR, FECHA, DESCRIPCION) VALUES (89, 1, '2019/8/22', 'Ajuste');
INSERT INTO MANTENIMIENTO(MAQUINA, PROVEEDOR, FECHA, DESCRIPCION) VALUES (90, 1, '2019/8/22', 'Ajuste');
INSERT INTO MANTENIMIENTO(MAQUINA, PROVEEDOR, FECHA, DESCRIPCION) VALUES (91, 1, '2019/8/22', 'Ajuste');

-- 'Pectoral fly'               ,                        ,                     ,'Ajuste y lubricación de tornillos'                                 ,8/22/2019
INSERT INTO MANTENIMIENTO(MAQUINA, PROVEEDOR, FECHA, DESCRIPCION) VALUES (88, 1, '2019/8/22', 'Ajuste y lubricación de tornillos');

-- 'Abdominal cruch'            ,'s/fzab0314b01'         ,                     ,'Lubricación '                                                      ,8/22/2019
INSERT INTO MANTENIMIENTO(MAQUINA, PROVEEDOR, FECHA, DESCRIPCION) VALUES (85, 1, '2019/8/22', 'Lubricación');

-- 'Hip & glute'                ,'s/pshgse'              ,                     ,'Ajuste de eje; guias'                                              ,8/22/2019
INSERT INTO MANTENIMIENTO(MAQUINA, PROVEEDOR, FECHA, DESCRIPCION) VALUES (84, 1, '2019/8/22', 'Ajuste de eje; guías');

-- 'Gluteo'                     ,                        ,                     ,'Ajuste de chumaceras'                                              ,8/22/2019
INSERT INTO MANTENIMIENTO(MAQUINA, PROVEEDOR, FECHA, DESCRIPCION) VALUES (134, 1, '2019/8/22', 'Ajuste de chumaceras');


-- 'Calf extension'             ,                        ,                     ,'Lubricación de guias'                                              ,8/22/2019
INSERT INTO MANTENIMIENTO(MAQUINA, PROVEEDOR, FECHA, DESCRIPCION) VALUES (77, 1, '2019/8/22', 'Lubricación de guías');

-- 'Leg curl'                   ,                        ,                     ,'Ajuste de chumaceras; lubricación de guias; ajuste de tornilleria' ,8/22/2019
INSERT INTO MANTENIMIENTO(MAQUINA, PROVEEDOR, FECHA, DESCRIPCION) VALUES (79, 1, '2019/8/22', 'Ajuste de chumaceras; lubricación de guias; ajuste de tornilleria');

-- 'Cross trainer integrity'    ,'nshxx110596'           ,                    ,'Ajuste de tapas '                                                  ,9/5/2019
INSERT INTO MANTENIMIENTO(MAQUINA, PROVEEDOR, FECHA, DESCRIPCION) VALUES (48, 1, '2019/9/5', 'Ajuste de tapas');


-- 'Leg curl'                   ,'hs-lc0418b008'         ,                     ,'Ajuste de pin selector; reparación de pin para peso adicional'     ,9/5/2019
INSERT INTO MANTENIMIENTO(MAQUINA, PROVEEDOR, FECHA, DESCRIPCION) VALUES (78, 1, '2019/9/5', 'Ajuste de pin selector; reparación de pin para peso adicional');

-- 'Caminadora integrity'       ,'ns hht121897'          ,                     ,'Instalación de tablero hct 102448'                                 ,9/18/2019
INSERT INTO MANTENIMIENTO(MAQUINA, PROVEEDOR, FECHA, DESCRIPCION) VALUES (12, 1, '2019/9/18', 'Instalación de tablero hct 102448');

-- 'Caminadora integrity'       ,'ns hht121894'          ,                     ,'Instalación de cable; key pad; kit emsamble; buiuf izquierdo'      ,9/18/2019
INSERT INTO MANTENIMIENTO(MAQUINA, PROVEEDOR, FECHA, DESCRIPCION) VALUES (18, 1, '2019/9/18', 'Instalación de cable; key pad; kit emsamble; buiuf izquierdo');

-- '3 Cross over (doble polea)' ,                        ,                     ,'Ajuste de tornilleria con loktine '                                ,9/27/2019
INSERT INTO MANTENIMIENTO(MAQUINA, PROVEEDOR, FECHA, DESCRIPCION) VALUES (126, 1, '2019/9/27', 'Ajuste de tornilleria con loktine');
INSERT INTO MANTENIMIENTO(MAQUINA, PROVEEDOR, FECHA, DESCRIPCION) VALUES (127, 1, '2019/9/27', 'Ajuste de tornilleria con loktine');
INSERT INTO MANTENIMIENTO(MAQUINA, PROVEEDOR, FECHA, DESCRIPCION) VALUES (128, 1, '2019/9/27', 'Ajuste de tornilleria con loktine');

-- 'Calf extension '            ,'f2cf031401'            ,                     ,'Ajuste de tuerca de cable de stack de peso'                        ,9/27/2019
INSERT INTO MANTENIMIENTO(MAQUINA, PROVEEDOR, FECHA, DESCRIPCION) VALUES (77, 1, '2019/9/27', 'Ajuste de tuerca de cable de stack de peso');

-- 'Seated leg curl'            ,                        ,'hsslc0118b28'       ,'Ajuste de tuerca de cable de stack de peso'                        ,9/27/2019
INSERT INTO MANTENIMIENTO(MAQUINA, PROVEEDOR, FECHA, DESCRIPCION) VALUES (78, 1, '2019/9/27', 'Ajuste de tuerca de cable de stack de peso');


-- 'Hip & glute'                ,                        ,'pshgse0314002'      ,'Lubricación de guis de peso '                                      ,9/27/2019
INSERT INTO MANTENIMIENTO(MAQUINA, PROVEEDOR, FECHA, DESCRIPCION) VALUES (84, 1, '2019/8/22', 'Lubricación de guías de peso');


-- 'Glute insignia'             ,                        ,                     ,'Lubricación de guias de zancada'                                   ,8/27/2019
INSERT INTO MANTENIMIENTO(MAQUINA, PROVEEDOR, FECHA, DESCRIPCION) VALUES (83, 1, '2019/9/27', 'Lubricación de guías de zancada');

-- 'Plataforma de power rack '  ,                        ,                     ,'Ajuste de gancho'                                                  ,9/27/2019
-- TODO esperamos al otro gimnasio
